{
  "schema_version": 1,
  "fixture": "upstream-secure-one-segment.bin",
  "sha256": "592152e22495cecb210cf5a7bfefac49f6cdd8bbbb14e223db3538bef0b3926d",
  "kind": "upstream-ceph-frameassembler",
  "source": {
    "repository": "https://github.com/ceph/ceph.git",
    "commit": "7f793731f1b39eb4f465e960113d2363c311b964",
    "paths": ["src/include/msgr.h", "src/include/crc32c.h", "src/common/sctp_crc32.c", "src/msg/async/frames_v2.h", "src/msg/async/frames_v2.cc", "src/msg/async/crypto_onwire.h", "src/msg/async/crypto_onwire.cc"]
  },
  "generator": {
    "tool": "Ceph FrameAssembler via libceph-common.so.2",
    "version": "ceph-common-20.2.4-0.el9",
    "command": ["./integration/p02/reproduce-upstream.sh"],
    "image": "quay.io/ceph/ceph@sha256:6bb1c8a42fbc0bf87938946990b65174466997bc11c31eb5a323225a779fd8f9"
  },
  "secrets": {"contains_secrets": false, "synthetic_only": true},
  "license": {"upstream_expression": "(LGPL-2.1-or-later AND BSD-3-Clause)", "redistribution": "pending", "reviewed_by": "pending human review"}
}