{
  "schema_version": 1,
  "fixture": "secure-multi-record.bin",
  "sha256": "f0c516007c9473215ababf72c8ab9058e8a5936cab97e2ca59fdde28849d37a1",
  "kind": "native-oracle",
  "source": {
    "repository": "https://github.com/ceph/ceph.git",
    "commit": "69f84cc2651aa259a15bc192ddaabd3baba07489",
    "paths": ["src/include/msgr.h", "src/include/crc32c.h", "src/common/sctp_crc32.c", "src/msg/async/frames_v2.h", "src/msg/async/frames_v2.cc", "src/msg/async/crypto_onwire.h", "src/msg/async/crypto_onwire.cc"]
  },
  "generator": {
    "tool": "source-derived independent C++/OpenSSL oracle",
    "version": "Ceph 20.2.0 contract",
    "command": ["./integration/p02/reproduce.sh"],
    "image": "quay.io/ceph/ceph@sha256:6bb1c8a42fbc0bf87938946990b65174466997bc11c31eb5a323225a779fd8f9"
  },
  "secrets": {"contains_secrets": false, "synthetic_only": true},
  "license": {"upstream_expression": "(LGPL-2.1-or-later AND BSD-3-Clause)", "redistribution": "pending", "reviewed_by": "pending human review"}
}