{
  "schema_version": 1,
  "fixture": "entity-addr-ipv6-modern.bin",
  "sha256": "a5b18e8166e8aa1d0c3285a6c1a3470851ae2bd229b28da857328c3bd2217986",
  "kind": "native-oracle",
  "source": {
    "repository": "https://github.com/ceph/ceph.git",
    "commit": "7f793731f1b39eb4f465e960113d2363c311b964",
    "paths": ["src/include/byteorder.h", "src/include/encoding.h", "src/include/ceph_features.h", "src/include/msgr.h", "src/msg/msg_types.h", "src/msg/msg_types.cc"]
  },
  "generator": {
  "tool": "ceph-dencoder",
  "version": "20.2.4",
  "command": ["docker", "run", "--rm", "-v", "$PWD:/src:ro", "quay.io/ceph/ceph@sha256:6bb1c8a42fbc0bf87938946990b65174466997bc11c31eb5a323225a779fd8f9", "ceph-dencoder", "type", "entity_addr_t", "import", "/src/integration/p01/entity-addr-ipv6-seed.bin", "decode", "encode", "export", "/dev/stdout"],
    "image": "quay.io/ceph/ceph@sha256:6bb1c8a42fbc0bf87938946990b65174466997bc11c31eb5a323225a779fd8f9"
  },
  "secrets": {"contains_secrets": false, "synthetic_only": true},
  "license": {"upstream_expression": "LGPL-2.1-or-later protocol facts; generated protocol data", "redistribution": "approved", "reviewed_by": "Oliver Tuschhoff"}
}
