{
  "schema_version": 1,
  "fixture": "osdmap-v8.bin",
  "sha256": "7131ba24e481dd198a90b6121d6fc2a16b32dc61928dfcd9f5df9efc730acda8",
  "kind": "upstream-derived",
  "source": {
    "repository": "https://github.com/ceph/ceph.git",
    "commit": "7f793731f1b39eb4f465e960113d2363c311b964",
    "paths": ["src/osd/OSDMap.h", "src/osd/OSDMap.cc"],
    "files": {
      "src/osd/OSDMap.h": "fd23f57b98235d6c36af2f2559c4bf3082c47d93a463b4cd6c84b7f91267cf36",
      "src/osd/OSDMap.cc": "36b74d8c998da9c93b7b0c9ba3ecac5d3e9df26bfb99c2f22095b37da44e0dc8"
    },
    "references": [{"type":"ceph-source","locator":"https://github.com/ceph/ceph.git","revision":"7f793731f1b39eb4f465e960113d2363c311b964","role":"OSDMap wire structure and ceph-dencoder fixture generation"}]
  },
  "generator": {"tool":"ceph-dencoder","version":"ceph version 20.2.4","command":["./integration/p04/reproduce-fixtures.sh"],"image":"quay.io/ceph/ceph@sha256:6e6bc7b28fa1b334108a3646af5533dfb50db508efdf5b358eb7dd0dd37a48aa"},
  "secrets": {"contains_secrets":false,"synthetic_only":true},
  "license": {"upstream_expression":"LGPL-2.1-or-later","redistribution":"pending","reviewed_by":"pending"}
}
