{
  "schema_version": 1,
  "fixture": "upmap-commands.txt",
  "sha256": "d12e266eee65d2d822f711e5d14bd66c379db9eb078645feeb96ea2554b2d30b",
  "kind": "native-oracle",
  "source": {
    "repository": "https://github.com/ceph/ceph.git",
    "commit": "7f793731f1b39eb4f465e960113d2363c311b964",
    "paths": ["src/osd/OSDMap.cc", "src/osd/osd_types.cc", "src/crush/mapper.c"],
    "files": {
      "src/osd/OSDMap.cc": "36b74d8c998da9c93b7b0c9ba3ecac5d3e9df26bfb99c2f22095b37da44e0dc8",
      "src/osd/osd_types.cc": "614710847acaebd82e17787b91b38e07198eec58488cd9f6d7283499e0fa6d3b",
      "src/crush/mapper.c": "d320fffa1a4b4b1c2d25b1c966f928b3d5ba2636889261054177cc37c41dbef7"
    },
    "references": [{"type":"ceph-source","locator":"https://github.com/ceph/ceph.git","revision":"7f793731f1b39eb4f465e960113d2363c311b964","role":"Deterministic pg_upmap_items applied to the oracle OSDMap"}]
  },
  "generator": {"tool":"osdmaptool","version":"ceph version 20.2.4","command":["./integration/p05/reproduce.sh"],"image":"quay.io/ceph/ceph@sha256:09ee90f6f3e0c7b9954f71d214ee05e9bbaaaea3716b1dd619603283b829f8b8"},
  "secrets": {"contains_secrets":false,"synthetic_only":true},
  "license": {"upstream_expression":"LGPL-2.1-or-later","redistribution":"pending","reviewed_by":"pending"}
}
