{
  "schema_version": 1,
  "fixture": "object-placements-osd1-out.jsonl",
  "sha256": "7b618af381521dd79597f49008acb0bfba528cc907afc56ecd46033cacd971d2",
  "kind": "native-oracle",
  "source": {
    "repository": "https://github.com/ceph/ceph.git",
    "commit": "7f793731f1b39eb4f465e960113d2363c311b964",
    "paths": ["src/osd/OSDMap.cc", "src/osd/osd_types.cc", "src/crush/mapper.c"],
    "files": {"src/osd/OSDMap.cc":"36b74d8c998da9c93b7b0c9ba3ecac5d3e9df26bfb99c2f22095b37da44e0dc8","src/osd/osd_types.cc":"614710847acaebd82e17787b91b38e07198eec58488cd9f6d7283499e0fa6d3b","src/crush/mapper.c":"d320fffa1a4b4b1c2d25b1c966f928b3d5ba2636889261054177cc37c41dbef7"},
    "references": [{"type":"ceph-source","locator":"https://github.com/ceph/ceph.git","revision":"7f793731f1b39eb4f465e960113d2363c311b964","role":"Erasure object placement during OSD-out up/acting transition"}]
  },
  "generator": {"tool":"ceph osd map","version":"ceph version 20.2.4","command":["./integration/p10/reproduce.sh with retained artifacts","ceph osd out 1","for i in 0..127: ceph osd map p10-ec p10-object-$i --format json | jq -c '{object,raw_pgid,pgid,up,up_primary,acting,acting_primary}'"],"image":"quay.io/ceph/ceph@sha256:6e6bc7b28fa1b334108a3646af5533dfb50db508efdf5b358eb7dd0dd37a48aa"},
  "secrets": {"contains_secrets":false,"synthetic_only":true},
  "license": {"upstream_expression":"LGPL-2.1-or-later","redistribution":"pending","reviewed_by":"pending"}
}
